{
  "schema": "ucc.workspace",
  "schema_version": 1,
  "id": "col_01K0A6R4V8W6E3M4M8Y0R9J2QW",
  "created_at": "2026-08-22T12:00:00.000Z",
  "created_by": "act_01K0A6R4V8W6E3M4M8Y0R9J2QA",
  "record_version": 1,
  "project_id": "prj_01K0A6R4V8W6E3M4M8Y0R9J2QP",
  "name": "dev-ws-1",
  "lifecycle": "active"
}
